{
  "contract_version": "1.0",
  "directive_id": "repair-example-1",
  "source_review_ref": "review-example-1",
  "source_audit_ref": "audit-example-1",
  "attempt": 1,
  "instructions": ["Correct the observed formatting mismatch"],
  "evidence_refs": ["evidence-verification-1"],
  "issued_at": "2026-01-01T00:06:00Z"
}
